{
  "platforms": [
    {
      "canonicalPromptSha256": "98e25d9e26471cee70b8f8cd2c6f170ef8b048b79c5f56a077949b2c8e0395f2",
      "catalogSha256": "7f3066333d9e72234fe610118a1375d1ba7768effb59cd85c41fea531dd155dd",
      "catalogSourceDigest": "3016533fe4558e1d113b6aa032fc73ed257abb1183a61d685fd62e33acd97e55",
      "generatedPromptSha256": "82d621d0339649b62acd1c359ccd96caab8bd76fcf9bf5434600d867a4d68141",
      "host": null,
      "platform": "claude-code",
      "probeContractVersion": 1,
      "probes": [],
      "reason": "No certified host was exercised for this platform.",
      "runAt": "2026-09-23T19:15:58Z",
      "runtimeStatus": "unverified-no-certified-host",
      "staticResults": {
        "argumentSource": "passed",
        "asset": "passed",
        "transport": "passed"
      },
      "targetMappingSha256": "8fa4def636b102454f3232946e49a6b12883d7025f9d1f6b004da90c0bf33ae8"
    },
    {
      "canonicalPromptSha256": "98e25d9e26471cee70b8f8cd2c6f170ef8b048b79c5f56a077949b2c8e0395f2",
      "catalogSha256": "7f3066333d9e72234fe610118a1375d1ba7768effb59cd85c41fea531dd155dd",
      "catalogSourceDigest": "3016533fe4558e1d113b6aa032fc73ed257abb1183a61d685fd62e33acd97e55",
      "generatedPromptSha256": "9bb1d4e53c099c816e5aa4ff427efdc260f8a773279f4e07a5a1dc80e63c1ec7",
      "host": null,
      "platform": "codex",
      "probeContractVersion": 1,
      "probes": [],
      "reason": "No certified host was exercised for this platform.",
      "runAt": "2026-09-23T19:15:58Z",
      "runtimeStatus": "unverified-no-certified-host",
      "staticResults": {
        "argumentSource": "passed",
        "asset": "passed",
        "transport": "passed"
      },
      "targetMappingSha256": "8fa4def636b102454f3232946e49a6b12883d7025f9d1f6b004da90c0bf33ae8"
    },
    {
      "canonicalPromptSha256": "98e25d9e26471cee70b8f8cd2c6f170ef8b048b79c5f56a077949b2c8e0395f2",
      "catalogSha256": "7f3066333d9e72234fe610118a1375d1ba7768effb59cd85c41fea531dd155dd",
      "catalogSourceDigest": "3016533fe4558e1d113b6aa032fc73ed257abb1183a61d685fd62e33acd97e55",
      "generatedPromptSha256": "98e25d9e26471cee70b8f8cd2c6f170ef8b048b79c5f56a077949b2c8e0395f2",
      "host": null,
      "platform": "copilot",
      "probeContractVersion": 1,
      "probes": [],
      "reason": "No certified host was exercised for this platform.",
      "runAt": "2026-09-23T19:15:58Z",
      "runtimeStatus": "unverified-no-certified-host",
      "staticResults": {
        "argumentSource": "passed",
        "asset": "passed",
        "transport": "passed"
      },
      "targetMappingSha256": "8fa4def636b102454f3232946e49a6b12883d7025f9d1f6b004da90c0bf33ae8"
    },
    {
      "canonicalPromptSha256": "98e25d9e26471cee70b8f8cd2c6f170ef8b048b79c5f56a077949b2c8e0395f2",
      "catalogSha256": "7f3066333d9e72234fe610118a1375d1ba7768effb59cd85c41fea531dd155dd",
      "catalogSourceDigest": "3016533fe4558e1d113b6aa032fc73ed257abb1183a61d685fd62e33acd97e55",
      "generatedPromptSha256": "c5c96e255779bf226ec85841da0873b668ce5f4a3db5793da4a48ad90740015e",
      "host": {
        "observedSha256": "ef75e680fa644d33aacbf881fc43449ee86c305f9120032775bde18705963aa5",
        "observedVersion": "7.7.7",
        "pinnedSha256": "ef75e680fa644d33aacbf881fc43449ee86c305f9120032775bde18705963aa5",
        "pinnedVersion": "7.7.7"
      },
      "platform": "kilo",
      "probeContractVersion": 1,
      "probes": [
        {
          "arguments": [
            "run",
            "--format",
            "json",
            "--command",
            "cg-help"
          ],
          "name": "overview",
          "outcome": "passed",
          "receivedQuerySha256": "e3b0c44298fc1c149afbf4c8996fb92427ae41e4649b934ca495991b7852b855"
        },
        {
          "arguments": [
            "run",
            "--format",
            "json",
            "--command",
            "cg-help"
          ],
          "name": "exact",
          "outcome": "passed",
          "receivedQuerySha256": "b23a860739870f496a9c6f75f48e3acaa735204c7af0a1296c36197a6bcca5ad"
        },
        {
          "arguments": [
            "run",
            "--format",
            "json",
            "--command",
            "cg-help"
          ],
          "name": "metacharacters",
          "outcome": "passed",
          "receivedQuerySha256": "bf83364c92b69441de418d0574c1264bfeed2d37df577eaa1a871a8b3e08a60f"
        }
      ],
      "reason": "",
      "runAt": "2026-09-23T19:12:48Z",
      "runtimeStatus": "verified",
      "staticResults": {
        "argumentSource": "passed",
        "asset": "passed",
        "transport": "passed"
      },
      "targetMappingSha256": "8fa4def636b102454f3232946e49a6b12883d7025f9d1f6b004da90c0bf33ae8"
    },
    {
      "canonicalPromptSha256": "98e25d9e26471cee70b8f8cd2c6f170ef8b048b79c5f56a077949b2c8e0395f2",
      "catalogSha256": "7f3066333d9e72234fe610118a1375d1ba7768effb59cd85c41fea531dd155dd",
      "catalogSourceDigest": "3016533fe4558e1d113b6aa032fc73ed257abb1183a61d685fd62e33acd97e55",
      "generatedPromptSha256": "e501a6e76a79fc0538293639a749ab7e00b80c546255740d27768576580b198d",
      "host": null,
      "platform": "opencode",
      "probeContractVersion": 1,
      "probes": [],
      "reason": "No certified host was exercised for this platform.",
      "runAt": "2026-09-23T19:15:58Z",
      "runtimeStatus": "unverified-no-certified-host",
      "staticResults": {
        "argumentSource": "passed",
        "asset": "passed",
        "transport": "passed"
      },
      "targetMappingSha256": "8fa4def636b102454f3232946e49a6b12883d7025f9d1f6b004da90c0bf33ae8"
    }
  ],
  "probeCommit": "2db8aa69fbc8caec5bc1657de8c443ccf0a35bdc",
  "probeTree": "9a8f091ef9af2407f8c039de347d0601dcb6c13d",
  "schemaVersion": 1,
  "sensitiveDigest": "2e8f4537dbdb4ed5b0a351761da6c28f53e1256c7b0f281a37c63389c1d3e6e1",
  "sensitivePaths": [
    {
      "mode": "100644",
      "path": ".agents/commands/cg-autopilot.md",
      "sha256": "27634296354a25c424b6f59f192798091dfcaff27423debdf1067239bf6a721b"
    },
    {
      "mode": "100644",
      "path": ".agents/commands/cg-brain-rebuild.md",
      "sha256": "6d0d70dc1eb541f6806149130bc2de61598dbcd33cdf9dc5549a7fc1bd31f9f8"
    },
    {
      "mode": "100644",
      "path": ".agents/commands/cg-brainstorm.md",
      "sha256": "0cecac322b3fb555070f4e43e719bf1244eab24fd380f8e18186a161bcdd5892"
    },
    {
      "mode": "100644",
      "path": ".agents/commands/cg-commit-push-pr.md",
      "sha256": "71700ad4e50994d3b4d34bfb16d55ce5cfee8c8c2904e7bd40e9e66e1df05b29"
    },
    {
      "mode": "100644",
      "path": ".agents/commands/cg-compound-gpid-rd.md",
      "sha256": "191185c6171e1997c1adf72f2e93e2ca4fc12955166c17bef5a1f60cf76a299b"
    },
    {
      "mode": "100644",
      "path": ".agents/commands/cg-compound-refresh.md",
      "sha256": "889b20ed52fe8b208dc1c2921873db019d0b9b6f6e8f72f7da21f658582b01be"
    },
    {
      "mode": "100644",
      "path": ".agents/commands/cg-compound.md",
      "sha256": "a4c18843ccf21c925eb5403d3ad90d59c8781201abdeb72563b5d15e2a255f70"
    },
    {
      "mode": "100644",
      "path": ".agents/commands/cg-devtag.md",
      "sha256": "91be68670a33ff130908010c26249f854436accb5c25d653939ebb33f8b4f394"
    },
    {
      "mode": "100644",
      "path": ".agents/commands/cg-diagnose.md",
      "sha256": "288e7699ea64362ff79d6d40cf378ae0706188596aedab4b003b14a3a4902ba3"
    },
    {
      "mode": "100644",
      "path": ".agents/commands/cg-fix-problems.md",
      "sha256": "fbb5eeaf6e98935d79f4964c34a1f382c603b446f67eb1b7d30f925620565cd7"
    },
    {
      "mode": "100644",
      "path": ".agents/commands/cg-fix-triage.md",
      "sha256": "51539f446b99701be6794f527c987624893fdb5a735434dd5489db93741cda1c"
    },
    {
      "mode": "100644",
      "path": ".agents/commands/cg-fixbug.md",
      "sha256": "46b05ece16a4a188776a1620d24b49e84264e6c0e83e7055894c46d0c423500e"
    },
    {
      "mode": "100644",
      "path": ".agents/commands/cg-help.md",
      "sha256": "9bb1d4e53c099c816e5aa4ff427efdc260f8a773279f4e07a5a1dc80e63c1ec7"
    },
    {
      "mode": "100644",
      "path": ".agents/commands/cg-ideate.md",
      "sha256": "11e24e1e65444f929413d534732bd5f36ab4cbdd9baf17414ebf17c8c8512960"
    },
    {
      "mode": "100644",
      "path": ".agents/commands/cg-issues.md",
      "sha256": "a291301a46ba3b6cc5f53609c3c75afd9d4640bb69a9e5a65b36e9a0de037e3f"
    },
    {
      "mode": "100644",
      "path": ".agents/commands/cg-light-work.md",
      "sha256": "df6a564c8c4f84182f8990a513b9f43b5ad162e609f055be651da5791e23f7e6"
    },
    {
      "mode": "100644",
      "path": ".agents/commands/cg-plan-review.md",
      "sha256": "2dd2d431b214697699d5ba919c96a291934df54ca2827bb0d2aece134d88eb99"
    },
    {
      "mode": "100644",
      "path": ".agents/commands/cg-plan.md",
      "sha256": "da2601654e011403bb66662e4bed3729a4d18f401b46ed2e2a804026346af712"
    },
    {
      "mode": "100644",
      "path": ".agents/commands/cg-release.md",
      "sha256": "3d6dad45c9297f04d654e72fd8e2024da8d97d33d93e7fb9d2c8a5a8cc7c0154"
    },
    {
      "mode": "100644",
      "path": ".agents/commands/cg-render-doc.md",
      "sha256": "3f4e493790bc785c45dc1d05f30a65cd8e30d47ca51cadfeb0d3ce5f782510f1"
    },
    {
      "mode": "100644",
      "path": ".agents/commands/cg-resume.md",
      "sha256": "a1b6c3c0b4746f4f63dc0eb18432c3e088a40d0f63b5a4554d5ea52cae971079"
    },
    {
      "mode": "100644",
      "path": ".agents/commands/cg-review.md",
      "sha256": "a8bc5a9747093e03e04d789271c9fbd2b2a0c8192c4260c905de36653812f787"
    },
    {
      "mode": "100644",
      "path": ".agents/commands/cg-roadmap-view.md",
      "sha256": "c064e5707de6463e9d2e50d1ae67d5c5287b3fdfa9278fe7b493e441dfa27b15"
    },
    {
      "mode": "100644",
      "path": ".agents/commands/cg-setup.md",
      "sha256": "d5b4feaa07ac641eddfeb45575e0b4b36747f616d1a2038cb8fb2bebf0206b21"
    },
    {